{
  "v": 1,
  "mailbox_id": "oKGio6SlpqeoqaqrrK2urw",
  "message_id": "ICEiIyQlJicoKSorLC0uLw",
  "expires_at": 1788109200,
  "payload": {
    "iv": "VVVVVVVVVVVVVVVVVVVVVQ",
    "ciphertext": "Qamem_I1iYdWyZ9lDHvjl96gXDbNgDPeDH1AsqLiA-Ef1yz3nABEOnvviCC1rqVBgTTf-VkwhZ5qxCB_oGRRpemiV8XqE6lpuMnJl2Tu83T2qHcC0rpU1gtr5owAWc5fx4IbDdqhHZ8pJ-X_fa08hjtpE_8sgBTfM7yfi5tYWysOdMQ_cb6qanbsWzeSgFOWzF_unYi462wTrRV60AGQRlbnWTY_VCaR1s2OJk8VtnrvIVvHy1hUyCj5h9aQGrvb5d_XIapOib99jup95_el4GdCJHYARt5aoun5jZqkgtKcRhrpBTBWBUAXjxng-XHc6842lml-NDLsCNn0VB7LjeD38VJrtu3dvjrph8fpo1xz_M1JKMdFexXArFwo_7BkB6x0uy96j5rpK1dYgJ48to02YRQY2yACOe_O2o5FDS84r5murff57r6_cF40Nn5womofIGZ_w3wD8Q809Tu4ovNMYM4h7g-v14Ypyvszk886xUEeqKKan16eBJOBTXPKhTAZreysepHCK_ogV38fZteWWB_N2FTpLqgsmI53nytVou1tIsklZf6zf1MaXF095jQoDCKDcGmYMVSFu0Y0cV0joaYVS2jqlFJBWRa7Nmnmg0t6Ie_W3t7f0TkvkhygZBKqgHLPd8dYaNp1bHBgAlsJ-J5cea0kA4xy4WSQO40",
    "tag": "BhRSxnFnUK4KjM5lQk_XtpWuAy9aRGyduHq6sbyQHGg"
  }
}
